{
  "schemaVersion": 1,
  "currentStage": "5d",
  "currentStageTitle": "Stage 5d — rescue economy (after settling the per-count A/B fork; 5-dark done)",
  "status": "not-started",
  "nextAction": "Stage 5-dark is DONE & LOCKED: the reconvened focus group (docs/DESIGN-V2-FOCUS-GROUP-R2.md) ruled the dormant DK-engagement pillar an inverted incentive; the patch (docs/DESIGN-V2-DARK-ENGAGEMENT.md) added the Hunt verb (AI darkHuntBias + cards-aware canStrikeWin + bestStepTowardHuntableDK), win-currency DK-kill auto-claim, asymmetric grudge Mark (GRUDGE_MARK_TOP_N=2, territoryRank), and DK-blocks-claim. Sim: DK-kills 0.00->2.05 (pillar alive); the patch over-strengthened the dark to 23.9%, so a coordinate-descent retune (scripts/tune-5dark.mjs, 2 seeds x 40) LOCKED SPREAD_AMOUNT_BASE 5->4 + DK_PER_PLAYER 1->0 (KEY FINDING: DK-army scaling BACKFIRES once kills pay — more rewarding DKs feed the players; the 40K panel hypothesis refuted). Confirmation sweep (sim-results/s20260622-n40): SK-win 20.5% PASS, per-count 30.9/21.8/8.9 (gradient 26.7->22.0pp, flatter), DK-kills 2.05, guards PASS, 2-seed stable (19.6%), rounds 11.93. Tests 379/379 green. The per-count A/B fork is RESOLVED (decision A — accept the gradient as a named identity ladder: 2p Duel / 3p Triumvirate / 4p Carve-up, canonized in DESIGN-V2-ALGORITHM.md §9.1; option B not built). NEXT: Stage 5d rescue economy (rescues still 0.07 — apply the SAME win-currency template per FOCUS-GROUP-R2 §4: a rescue must pay the rescuer in win-currency, not a soft favor; wire RESCUE_COST/BREAK_THRESHOLD into the seam). Gambit honest fire 25.2% (>10-20 band) is a separate 5d/5e item, NOT a 5-dark regression. Then 5e (Blood Pact accusation), 5f (2-seed lock + §9 doc).",
  "specRefs": [
    "docs/DESIGN-V2-FOCUS-GROUP-R2.md (panel round-2 synthesis) + docs/DESIGN-V2-DARK-ENGAGEMENT.md (the mechanic spec)",
    "docs/handoff/stage5-tuning-log.md §5-dark (the evidence trail + retune + the DK-scaling-backfires finding)",
    "src/v2/tunables.ts (SPREAD_AMOUNT_BASE=4, DK_PER_PLAYER=0, DK_BLOCKS_CLAIM/DK_KILL_CLAIMS_NODE/GRUDGE_MARK_TOP_N), src/v2/ai-player.ts (darkHuntBias/canStrikeWin/bestStepTowardHuntableDK), src/v2/combat.ts (territoryRank + win-currency claim + asymmetric grudge)",
    "sim-results/s20260622-n40/REPORT.md (the 5-dark LOCKED report: SK-win 20.5%, DK-kills 2.05, per-count 2p 30.9/3p 21.8/4p 8.9)",
    "scripts/tune-5dark.mjs (the retune search), ROADMAP §4"
  ],
  "lastVerified": {
    "timestamp": "2026-06-23T01:11:14.128Z",
    "commit": "55c60a8",
    "sourceHash": "7fdc972dc3c9b18721772ff73b4e4d6ac18846b232f29d61655e41c9cbb0525c",
    "typecheck": "pass",
    "lint": "pass",
    "tests": {
      "files": 23,
      "passed": 379,
      "failed": 0,
      "status": "pass"
    }
  },
  "dirty": true,
  "invariants": [
    "All mutation goes through applyCommand (src/v2/reducer.ts) — no direct state mutation elsewhere",
    "No Math.random / Date.now / any in src/v2 — all RNG via SeededRandom (ALGORITHM §7)",
    "GameState is JSON-serializable (clone = JSON.parse(JSON.stringify))",
    "AI decisions must be pure f(state, seed) (ALGORITHM §7.9) — required for reproducibility",
    "Layer B (blood_pact) only: pledges emit PLEDGE_COMMITTED (concealed) not PLEDGE_SUBMITTED; real tiers go to suspicionLog; the traitor forfeits the doom_complete win iff bloodPactExposed. Competitive mode behavior is unchanged."
  ],
  "gotchas": [
    "`npm test` includes ~50 RED v1 tests by design (they anchor v1) — use `npm run test:v2` for the v2 suite",
    "vitest output buffers when piped through `tail` — redirect to a file, or use the JSON reporter (verify.mjs does)",
    "Run `npm run verify` to (re)populate this block; never hand-edit lastVerified/dirty",
    "ACTION pointer quirk: after the LAST player in turnOrder exhausts actions, advanceActivePlayer leaves activePlayerIndex ON that player (turnOrderPosition === turnOrder.length). Any per-player action loop must ALSO stop on actionsRemaining===0, not just the index — else it re-enters a 0-action player (runAITurn handles this).",
    "The v2 UI lives in src/ui-v2 (entry index.html → src/ui-v2/main.ts; old v1 harness preserved at index-v1.html). It is OUTSIDE the verify lint/test scope (src/v2 tests/v2), but tsc --noEmit covers all of src/ so it must typecheck. Validate UI changes with `npm run dev` (or `npx vite build`); the headless session driver has logic coverage in tests/v2/ui-session.test.ts."
  ],
  "openRisks": [
    "STAGE-5a DIAGNOSTIC FINDINGS (the pooled numbers hid these — sim-results/sample/REPORT.md): (1) SK-win is WILDLY uneven by player count — 2p 29.2% / 3p 11.6% / 4p 1.9% (pooled 14.3%). The dark is nearly unwinnable at 4p and too strong at 2p → the #1 5c fix is the doomCost() PLAYER-COUNT SCALING (currently base*playerCount/4: more pledgers block far more easily at 4p). (2) DK-kills = 0.00/game — players NEVER engage the dark's Death Knights (DKs sit on outer seams players don't visit), so pushback/grudge/heroic mechanics are DORMANT; consider relevant in 5d. (3) gambler-FREE gambit fire 27.2% (above the 10-20% band — driven by opportunist/aggressor gambitAmbition, not just the gambler archetype) → may need a SMALL gambit nerf after all. (4) breaks 0.73/game but conditional-rescue 13.4% → both more breaks AND more rescue-uptake needed for 2-4 rescues. Pledge full-block 40%, mean ashed 6.09.",
    "TRUSTWORTHY POST-4g SWEEP FINDINGS (4200 games — sim-results/sample/REPORT.md): SK win 14.3% pooled (but see the 5a per-count finding below — it's the scaling that's broken, not just the level), rescues 0.10/game (under-fires), BP accusation accuracy 20.5%. GOOD: no dominant strategy, free-riding NOT rewarded. Gambit: the earlier 'OVERPOWERED' aggregate alarm is a stress-archetype confound, but 5a's gambler-free measure (27%) is mildly above band — a small nerf may be warranted, NOT the 49%-driven over-nerf.",
    "The anti-free-rider reward (§4.2 step 5, Stage 3f) MEASURES as working across both pre- and post-4g sweeps (winners don't pledge less) — but PLEDGE_SHIELD_AMOUNT / PLEDGE_FAVOR_GRUDGE_REDUCTION are still placeholder [TUNABLE]; confirm it holds after Stage-5 retuning.",
    "DATA-TRUST CAVEAT (4g notes): combat commits are now value-aware but the ENGINE auto-decides them (COMBAT_COMMIT_MAX, RAID_DEFENSE_MARGIN) rather than a per-policy choice; the Last Stand is also engine-auto. Good enough for balance signal, but a future improvement is to make combat commits a policy decision. The PUSHBACK(1)==DAWN_BLIGHT_ADVANCE(1) relationship can let the front stall (tunables.ts note) — a Stage-5 tuning call.",
    "Blood Pact accusation tuning (AUDIT_COST, ACCUSATION_* penalties/cooldown, SUSPICION_LOG_ROUNDS, TRAITOR_EXPOSED_WOUNDS) is placeholder — must be balanced in Stage 5 so accusation is neither spammed nor never-fired.",
    "Stage 3f effect-table / Last-Stand / rescue-debt magnitudes (SURGE_SPREAD_MULT, DK_MARCH_DISTANCE, GAMBIT_ADJACENT_STRIKE_MULT, RESCUE_DEBT_MIN_PLEDGE, the deterministic Last-Stand 'fight if you can win' rule) are reasonable defaults, not balanced — Stage-5 sim must validate them.",
    "Archetype AI (Stage 4b) now pursues RAID/RESCUE/Gambit; Last Stand remains engine-auto and Audit/Accusation are NOT yet in the AI action loop (wired in 4f for Blood Pact) — the Stage-4 competitive sweep under-exercises the BP deduction paths until then."
  ]
}
